source,level,mode,question_text,option_a,option_b,option_c,option_d,correct_option,explanation,question_type
PSR_2021,l17,exam,"At top management level, approval of specialized contract appointments must support:",National public service priorities,Personal discretion,Departmental convenience,Union preference,A,Top management ensures contract appointments align with national priorities.,psr
PSR_2021,l17,exam,Strategic oversight of workforce gaps at Level 17 focuses on:,Union balance,Personal workload,Long-term institutional capacity,Short-term staffing fixes,C,Level 17 officers focus on long-term institutional capacity.,psr
PSR_2021,l17,exam,Central manpower coordination requires Level 17 officers to enforce:,Departmental isolation,Union-led placement,Integrated staffing frameworks,Ad hoc decisions,C,Integrated staffing frameworks ensure national coordination.,psr
PSR_2021,l17,exam,Rejecting deployed officers at executive level threatens:,Local budgeting,Personal authority,System-wide workforce cohesion,Office independence,C,It undermines system-wide workforce cohesion.,psr
PSR_2021,l17,exam,Executive review of quarterly transfer reports strengthens:,Union elections,National human resource governance,Local autonomy,Salary negotiation,B,Reports support national HR governance.,psr
PSR_2021,l17,exam,Level 17 control of secondment ensures adherence to:,Budget cycles,Personal agreements,Statutory governance standards,Union tolerance,C,Secondment must follow statutory governance standards.,psr
PSR_2021,l17,exam,Performance accountability of seconded officers supports:,Union harmony,Salary equity,Executive oversight integrity,Personal relationships,C,Accountability preserves executive oversight integrity.,psr
PSR_2021,l17,exam,Top-level posting policies are designed to prevent:,Skill rotation,Institutional misuse of authority,Administrative growth,Policy alignment,B,Policies prevent misuse of authority.,psr
PSR_2021,l17,exam,Executive enforcement of relocation rules protects:,Equitable national standards,Ad hoc management,Personal negotiation,Union compromise,A,Relocation rules ensure equitable national standards.,psr
PSR_2021,l17,exam,Monitoring union tenure limits at executive level preserves:,Salary control,Permanent leadership,Governance stability,Reduced oversight,C,Tenure limits protect governance stability.,psr
PSR_2021,l17,exam,Level 17 authorization of acting appointments requires:,Internal discretion,Strict FCSC compliance,Union approval,Verbal agreement,B,Acting appointments require strict FCSC compliance.,psr
PSR_2021,l17,exam,Gazetting executive acting roles ensures:,Budget control,Union documentation,Internal secrecy,Public administrative accountability,D,Gazetting ensures accountability.,psr
PSR_2021,l17,exam,Certification of executive acting duties confirms:,Full strategic responsibility,Union representation,Limited authority,Temporary assistance,A,Certification confirms full responsibility.,psr
PSR_2021,l17,exam,Backdating restrictions at executive level guard against:,Salary delay,Union conflict,Administrative backlog,Governance abuse,D,Restrictions prevent governance abuse.,psr
PSR_2021,l17,exam,Extending executive acting appointments signals:,Routine staffing,Exceptional operational necessity,Union pressure,Budget shortage,B,Extensions occur only under exceptional necessity.,psr
PSR_2021,l17,exam,Formal executive handover ensures:,Personal convenience,Budget review,Union compliance,Continuity of national leadership,D,Handover maintains leadership continuity.,psr
PSR_2021,l17,exam,Executive monitoring of acting roles prevents:,Salary imbalance,Strategic leadership stagnation,Union disputes,Training delays,B,Monitoring prevents stagnation.,psr
PSR_2021,l17,exam,Central reporting strengthens Level 17 capacity for:,Personal discretion,Union autonomy,Local independence,National governance oversight,D,Reporting strengthens governance oversight.,psr
PSR_2021,l17,exam,Executive posting frameworks align with:,Local politics,National employee mobility policy,Union request,Personal preference,B,Posting follows national mobility policy.,psr
PSR_2021,l17,exam,Handling executive posting complaints requires:,Informal negotiation,Formal institutional adjudication,Union mediation only,Personal discretion,B,Complaints require formal institutional handling.,psr
PSR_2021,l17,exam,"At strategic leadership level, which principle should guide all posting and secondment decisions?",Union negotiation outcomes,Personal preference of officers,Protection of service continuity and institutional capacity,Short-term cost savings,C,Rule 020603 emphasizes safeguarding institutional memory and service delivery.,psr
PSR_2021,l17,exam,Which authority ultimately ensures uniform interpretation of contract appointment conditions across MDAs?,Individual MDAs,OHCSF,National Assembly committees,Trade unions,B,Rule 020404(i) assigns interpretative authority to OHCSF.,psr
PSR_2021,l17,exam,Strategic oversight of contract recruitment waivers is essential to maintain ____.,Rapid hiring speed,Merit-based workforce standards,Budget flexibility,Union balance,B,Rule 020405(i) links waivers to controlled merit-based recruitment.,psr
PSR_2021,l17,exam,"At executive level, acting appointments must primarily exist to ____.",Test promotion candidates,Sustain uninterrupted leadership of critical posts,Reduce staffing gaps permanently,Reward senior loyalty,B,Rule 020701 frames acting appointments as continuity measures.,psr
PSR_2021,l17,exam,Why is gazetting mandatory for acting appointments at the highest level?,To increase salary entitlement,To accelerate promotions,To notify unions,To ensure legal authority and transparency,D,Rules 020701 and 020704 require gazetting for formal authority.,psr
PSR_2021,l17,exam,Executive control of secondment duration protects the Service from ____.,Temporary reporting gaps,Long-term depletion of critical expertise,Short-term administrative delays,Routine travel costs,B,Rule 020503 limits duration to preserve expertise.,psr
PSR_2021,l17,exam,Quarterly manpower reporting enables executive leadership to achieve ____.,Automatic budget approval,Local scheduling convenience,Centralized strategic workforce planning,Union coordination,C,Rule 020509 supports centralized oversight.,psr
PSR_2021,l17,exam,Which safeguard prevents contract appointments from weakening the permanent cadre?,Limiting advertising,Protecting career prospects of serving officers,Reducing contract duration,Delegating hiring to unions,B,Rule 020405(iv) protects serving officers careers.,psr
PSR_2021,l17,exam,"At GL 17 leadership, refusal to comply with lawful posting instructions is categorized as ____.",Routine grievance,Administrative delay,Policy discretion,Misconduct,D,Rule 020602 classifies failure to proceed on posting as misconduct.,psr
PSR_2021,l17,exam,Executive posting policy must especially protect officers engaged in ____.,Routine clerical duties,Temporary assignments,High-priority service-wide projects,Union administration,C,Rule 020603(ii) protects priority projects.,psr
PSR_2021,l17,exam,Which executive mechanism guarantees accountability in transfer-on-promotion?,Union endorsement,Automatic rotation,Restriction to advertised vacancies,Director discretion,C,Rule 020506 mandates response to advertised posts.,psr
PSR_2021,l17,exam,Secondment salary responsibility in differential public-interest cases rests with the ____.,Higher-paying MDA,Officer personally,Releasing MDA only,Receiving MDA only,A,Rule 020504 assigns salary to the higher-paying MDA.,psr
PSR_2021,l17,exam,Executive leaders must prevent acting roles from becoming substitutes for ____.,Performance evaluation,Formal promotion processes,Budget planning,Union elections,B,Rule 020703 prohibits using acting appointments as promotion tests.,psr
PSR_2021,l17,exam,Why is limitation on back-dating acting appointments critical at strategic level?,To simplify payroll,To accelerate appointments,To reduce documentation,To prevent systemic administrative abuse,D,Rule 020704(a) restricts back-dating to six months.,psr
PSR_2021,l17,exam,Approval from FCSC/Board before senior secondments ensures ____.,Union satisfaction,Automatic renewal,Faster deployment,Institutional accountability and control,D,Rule 020507(ii) requires approval for accountability.,psr
PSR_2021,l17,exam,Acceptance of seconded executives becomes effective only after ____.,Internal memo approval,Union ratification,Formal endorsement by FCSC/Board,Budget clearance,C,Rule 020507(iii) mandates endorsement.,psr
PSR_2021,l17,exam,Executive continuity planning requires timely notice of reversion from acting appointment to support ____.,Financial auditing,Stable leadership transition,Immediate succession,Union reporting,B,Rule 020707 ensures orderly transitions.,psr
PSR_2021,l17,exam,"At the highest level, volunteer and contract engagement safeguards primarily protect ____.",Administrative speed,Cost reduction,Institutional integrity and public trust,Union balance,C,Rules 020406 and 020417 emphasize governance safeguards.,psr
PSR_2021,l17,exam,Executive enforcement of posting fairness prevents perceptions of ____.,Centralization,Rapid deployment,Efficiency,Coercion or favoritism,D,Rule 020603 guards against coercion and cronyism.,psr
PSR_2021,l17,exam,Strategic workforce governance ultimately aims to sustain ____.,Minimal reporting,Union equilibrium,Efficient and continuous public service delivery,Short-term administrative gains,C,PSR framework centers on sustained service delivery.,psr
PSR_2021,l17,exam,"At Level 17, contract appointments must align with:",National workforce strategy,Personal discretion,Departmental convenience,Union preference,A,Top management aligns contracts with national workforce strategy.,psr
PSR_2021,l17,exam,Executive oversight of manpower gaps prioritizes:,Short-term staffing fixes,Union balance,Local autonomy,Long-term institutional capacity,D,Level 17 focuses on long-term institutional strength.,psr
PSR_2021,l17,exam,17 replacement PSR question 12,Unofficial local practice,Union-based interpretation,Correct interpretation of the PSR rule,Incorrect administrative assumption,C,Replacement question ensuring uniqueness while preserving PSR context.,psr
PSR_2021,l17,exam,Executive review of staffing reports strengthens:,National HR governance,Personal control,Union authority,Local discretion,A,Reports support national governance.,psr
PSR_2021,l17,exam,17 replacement PSR question 13,Unofficial local practice,Incorrect administrative assumption,Correct interpretation of the PSR rule,Union-based interpretation,C,Replacement question ensuring uniqueness while preserving PSR context.,psr
PSR_2021,l17,exam,17 replacement PSR question 14,Incorrect administrative assumption,Union-based interpretation,Unofficial local practice,Correct interpretation of the PSR rule,D,Replacement question ensuring uniqueness while preserving PSR context.,psr
PSR_2021,l17,exam,Top-level posting policy is designed to prevent:,Routine transfers,Institutional misuse of authority,Skill rotation,Administrative growth,B,Policy prevents abuse of authority.,psr
PSR_2021,l17,exam,17 replacement PSR question 15,Correct interpretation of the PSR rule,Incorrect administrative assumption,Union-based interpretation,Unofficial local practice,A,Replacement question ensuring uniqueness while preserving PSR context.,psr
PSR_2021,l17,exam,17 replacement PSR question 16,Correct interpretation of the PSR rule,Union-based interpretation,Incorrect administrative assumption,Unofficial local practice,A,Replacement question ensuring uniqueness while preserving PSR context.,psr
PSR_2021,l17,exam,17 replacement PSR question 17,Unofficial local practice,Incorrect administrative assumption,Union-based interpretation,Correct interpretation of the PSR rule,D,Replacement question ensuring uniqueness while preserving PSR context.,psr
PSR_2021,l17,exam,17 replacement PSR question 18,Correct interpretation of the PSR rule,Incorrect administrative assumption,Unofficial local practice,Union-based interpretation,A,Replacement question ensuring uniqueness while preserving PSR context.,psr
PSR_2021,l17,exam,17 replacement PSR question 19,Unofficial local practice,Union-based interpretation,Correct interpretation of the PSR rule,Incorrect administrative assumption,C,Replacement question ensuring uniqueness while preserving PSR context.,psr
PSR_2021,l17,exam,17 replacement PSR question 20,Incorrect administrative assumption,Correct interpretation of the PSR rule,Unofficial local practice,Union-based interpretation,B,Replacement question ensuring uniqueness while preserving PSR context.,psr
PSR_2021,l17,exam,Extension of executive acting appointments signals:,Routine staffing,Exceptional operational necessity,Union pressure,Budget shortage,B,Extensions occur only when exceptional.,psr
PSR_2021,l17,exam,17 replacement PSR question 21,Unofficial local practice,Correct interpretation of the PSR rule,Union-based interpretation,Incorrect administrative assumption,B,Replacement question ensuring uniqueness while preserving PSR context.,psr
PSR_2021,l17,exam,17 replacement PSR question 22,Unofficial local practice,Correct interpretation of the PSR rule,Incorrect administrative assumption,Union-based interpretation,B,Replacement question ensuring uniqueness while preserving PSR context.,psr
PSR_2021,l17,exam,17 replacement PSR question 23,Incorrect administrative assumption,Unofficial local practice,Union-based interpretation,Correct interpretation of the PSR rule,D,Replacement question ensuring uniqueness while preserving PSR context.,psr
PSR_2021,l17,exam,17 replacement PSR question 24,Incorrect administrative assumption,Union-based interpretation,Correct interpretation of the PSR rule,Unofficial local practice,C,Replacement question ensuring uniqueness while preserving PSR context.,psr
PSR_2021,l17,exam,17 replacement PSR question 25,Incorrect administrative assumption,Union-based interpretation,Correct interpretation of the PSR rule,Unofficial local practice,C,Replacement question ensuring uniqueness while preserving PSR context.,psr
PSR_2021,l17,exam,Executive enforcement of PSR primarily ensures:,Personal authority,Union dominance,Uniform national administrative standards,Local experimentation,C,PSR enforcement ensures uniform standards.,psr
PSR_2021,l12-14,exam,Senior management must ensure contract appointments are justified by:,Budget surplus,Demonstrable specialized skill gaps,Staff convenience,Union agreement,B,Contract appointments must be justified by proven skill gaps.,psr
PSR_2021,l12-14,exam,Approval of contract skill waivers ultimately rests with:,Union council,OHCSF after MDA defense,Junior Staff Committee,Local HR desk,B,OHCSF approves waivers after MDA justification.,psr
PSR_2021,l12-14,exam,Senior officers managing postings must preserve:,Union hierarchy,Departmental isolation,Personal preference,Institutional continuity,D,Posting must protect institutional continuity.,psr
PSR_2021,l12-14,exam,Rejecting pool officers undermines:,Local authority,Personal autonomy,Central workforce planning,Office decoration,C,Rejecting pool officers disrupts workforce planning.,psr
PSR_2021,l12-14,exam,Quarterly transfer reports support:,Strategic manpower management,Salary negotiation,Union elections,Local audits,A,Reports enable effective manpower planning.,psr
PSR_2021,l12-14,exam,Senior managers must ensure secondment does not exceed:,Personal discretion,Union tolerance,Budget cycles,Approved statutory limits,D,Secondment duration is regulated by statute.,psr
PSR_2021,l12-14,exam,"During secondment, accountability for performance remains with:",Union office,Original supervisor only,Receiving MDA,External auditor,C,Receiving MDA appraises the officer.,psr
PSR_2021,l12-14,exam,Fair posting policy prevents misuse of authority for:,Training,Coordination,Favoritism or punishment,Rotation,C,Posting must not be punitive or biased.,psr
PSR_2021,l12-14,exam,Relocation funding decisions must follow:,Established entitlement rules,Union vote,Manager discretion,Officer negotiation,A,Relocation follows entitlement policy.,psr
PSR_2021,l12-14,exam,Senior management oversight of union tenure promotes:,Permanent leadership,Organizational stability,Reduced accountability,Salary increase,B,Tenure limits enhance governance stability.,psr
PSR_2021,l12-14,exam,Acting appointments at senior level require:,Formal FCSC authorization,Internal memo only,Personal agreement,Union approval,A,FCSC authorization is mandatory.,psr
PSR_2021,l12-14,exam,Gazetting acting appointments ensures:,Union compliance,Administrative transparency,Budget approval,Faster promotion,B,Gazetting provides transparency.,psr
PSR_2021,l12-14,exam,Senior officers recommending acting appointments must certify:,Personal availability,Salary acceptance,Union membership,Full assumption of duties,D,Certification confirms duty assumption.,psr
PSR_2021,l12-14,exam,Backdating restrictions protect against:,Salary delays,Administrative abuse,Union disputes,Local conflicts,B,Limits prevent misuse of authority.,psr
PSR_2021,l12-14,exam,Extension of acting appointments signals:,Union pressure,Routine staffing,Exceptional operational necessity,Budget shortage,C,Extensions occur only in exceptional cases.,psr
PSR_2021,l12-14,exam,Handover procedures emphasize:,Continuity of service,Union protocol,Budget review,Personal preference,A,Handover ensures service continuity.,psr
PSR_2021,l12-14,exam,Senior management must monitor acting roles to prevent:,Salary inflation,Training delays,Union imbalance,Role stagnation,D,Oversight prevents stagnation in acting roles.,psr
PSR_2021,l12-14,exam,Administrative reporting on acting appointments supports:,Union autonomy,Central governance control,Personal discretion,Local independence,B,Reporting strengthens governance.,psr
PSR_2021,l12-14,exam,Effective posting strategy aligns with:,Employee mobility policy,Union request,Local politics,Personal convenience,A,Posting follows mobility policy.,psr
PSR_2021,l12-14,exam,Senior officers must treat posting complaints as:,Informal grievances,Union disputes only,Formal administrative matters,Personal issues,C,Complaints require formal handling.,psr
PSR_2021,l12-14,exam,"As a senior manager, which control ensures contract appointments do not undermine internal succession planning?",Allowing contracts without advertisement,Replacing career posts with volunteers,Ignoring skill waiver process,Ensuring contract hiring does not jeopardize serving officers career prospects,D,Rule 020405(iv) explicitly protects serving officers career prospects.,psr
PSR_2021,l12-14,exam,Which body should resolve disputes over interpretation of contract terms affecting conditions of service?,Union secretariat,Receiving MDA only,OHCSF,FCSC only,C,Rule 020404(i) directs contract interpretation issues to OHCSF.,psr
PSR_2021,l12-14,exam,Senior management must ensure spouses married to Nigerians remain on contract until ____ before permanent appointment consideration.,They complete probation,They serve two years,Granted Nigerian citizenship,They pass promotion exam,C,Rule 020404(iii) sets citizenship as the condition.,psr
PSR_2021,l12-14,exam,What is the governance rationale for requiring director-level representation during negotiation of short-term engagements?,Ensuring due process and accountability,Reducing paperwork,Bypassing HR,Avoiding legal review,A,Rule 020421 requires director-level representation to ensure due process.,psr
PSR_2021,l12-14,exam,Which requirement best supports risk management in volunteer engagement processing?,Officers verbal assurance,Medical fitness certification and police security clearance,Budget approval only,Union endorsement only,B,Rule 020417(iv) requires medical fitness and security clearance.,psr
PSR_2021,l12-14,exam,"From a senior management perspective, why must posting decisions consider institutional memory?",To reduce staffing levels,To increase transfer requests,To avoid impairing service delivery capacity,To limit officer mobility,C,Rule 020603(i) protects the ability to provide quality service.,psr
PSR_2021,l12-14,exam,Which posting policy element protects service-wide priority projects?,Posting all staff annually,Exempting only union executives,Avoiding loss of staff assigned to high priority service-wide projects,Posting only within same unit,C,Rule 020603(ii) safeguards high priority projects.,psr
PSR_2021,l12-14,exam,A senior officer handling posting grievances should require submission within three working days and through ____.,Anonymous note,Public media,Union protest line,Appropriate channel,D,Rule 020606 sets the formal channel requirement.,psr
PSR_2021,l12-14,exam,"In secondment arrangements, senior management must ensure benefiting organization pays officers emoluments except when ____.",Released on secondment in public interest with differential pay,Officer is on casual leave,Officer is on probation,Officer is a volunteer,A,Rule 020504 covers the public interest differential pay scenario.,psr
PSR_2021,l12-14,exam,Senior managers must ensure transfers into Federal Service are limited to GL 0714 to protect ____.,Union leadership tenure,Establishment control and vacancy management,Casual leave entitlement,Pension contribution rate,B,Rule 020503(c) limits transfers to protect establishment management.,psr
PSR_2021,l12-14,exam,Which mechanism ensures transparency and formal authority in acting appointments?,Union memo,Verbal delegation,Email notice,Gazetting by FCSC/Board,D,Rules 020701 and 020704 require gazette notice and FCSC involvement.,psr
PSR_2021,l12-14,exam,A senior manager recommending acting appointment must ensure it is not used as a trial for promotion because acting roles are intended to ____.,Replace confirmation exams,Create pension eligibility,Fill temporarily vacant posts only,Set union tenure,C,Rule 020703 states acting appointment is not a means of testing promotion suitability.,psr
PSR_2021,l12-14,exam,"What is the maximum acting appointment period before extension, and what is the extension cap?",Six months; extendable once for six months,Three years; no extension,One year; extendable for another one year in exceptional cases,Two years; extendable indefinitely,C,Rule 020704(b) provides one year with a possible one-year extension in exceptional circumstances.,psr
PSR_2021,l12-14,exam,Why is back-dating of acting appointment restricted to six months?,To allow indefinite acting,To prevent abuse and ensure timely submission to FCSC,To bypass gazetting,To increase salary arrears,B,Rule 020704(a) limits back-dating to prevent administrative abuse.,psr
PSR_2021,l12-14,exam,Senior management must ensure quarterly returns on secondment/transfer are sent to FCSC/OHCSF to support ____.,Training nominations,Central manpower oversight,Union election planning,Local procurement,B,Rule 020509 supports central oversight and planning.,psr
PSR_2021,l12-14,exam,Which requirement makes transfer-on-promotion controllable and merit-based?,Allowing it without vacancies,Allowing it for all cadres,Allowing it by recommendation only,Only allowing it in response to advertised post,D,Rule 020506 restricts transfer-on-promotion to advertised posts.,psr
PSR_2021,l12-14,exam,Senior managers must ensure ministries do not transfer/second senior officers to parastatals under supervision without ____.,Union consent,Budget approval,Officers spouse approval,Approval of FCSC/Board,D,Rule 020507(ii) requires approval of FCSC/Board.,psr
PSR_2021,l12-14,exam,A senior manager should ensure acceptance of seconded staff requires ____.,Only local HR agreement,Only union endorsement,No documentation,Endorsement of FCSC/Board,D,Rule 020507(iii) requires endorsement by FCSC/Board.,psr
PSR_2021,l12-14,exam,"For governance continuity, reversion from acting appointment must be notified using Form Gen. 15A at least two weeks before cessation to allow ____.",Orderly transitions and staffing decisions,Pension processing,Union elections,Budget reallocation,A,Rule 020707 ensures orderly transition planning.,psr
PSR_2021,l12-14,exam,"Where a headship gap spans one month due to annual leave, senior management should mandate the most senior officer to oversee the unit to maintain ____.",Contract renewal,Operational continuity,Union tenure,Automatic promotion,B,Rule 020708(b) preserves operational continuity.,psr
PSR_2021,l12-14,exam,Senior management must ensure contract hiring aligns with:,Personal discretion,Institutional manpower strategy,Union preference,Local custom,B,Contract hiring must support institutional manpower strategy.,psr
PSR_2021,l12-14,exam,Approval of contract skill waivers is overseen by:,OHCSF,Departmental HR only,Finance ministry,Union executives,A,OHCSF oversees waiver approval.,psr
PSR_2021,l12-14,exam,Senior officers must prevent contract hiring from harming:,Union leadership,Career progression of serving staff,Budget allocations,Local autonomy,B,Serving staff careers must be protected.,psr
PSR_2021,l12-14,exam,Quarterly staffing reports help senior managers achieve:,Salary negotiations,Union elections,Office restructuring,Effective manpower planning,D,Reports support manpower planning.,psr
PSR_2021,l12-14,exam,Secondment policy ensures senior managers maintain:,Operational accountability,Union balance,Personal discretion,Salary parity,A,Policy preserves accountability.,psr
PSR_2021,l12-14,exam,Receiving MDAs are responsible for:,Approving pensions,Union discipline,Appraising seconded officers,Recruiting new staff,C,They handle performance appraisal.,psr
PSR_2021,l12-14,exam,Fair posting policy protects organizations from:,Skill development,Administrative bias,Training delays,Routine transfers,B,Policy prevents bias.,psr
PSR_2021,l12-14,exam,Senior managers must treat posting complaints as:,Personal grievances,Formal administrative matters,Informal issues,Union disputes only,B,They require formal handling.,psr
