source,level,mode,question_text,option_a,option_b,option_c,option_d,correct_option,explanation,question_type
PSR_2021,l5-7,exam,Posting complaints must follow:,Court action first,Informal discussion,Union protest only,Formal administrative channels,D,Complaints use official channels.,psr
PSR_2021,l5-7,exam,Relocation cost after posting is borne by:,Union fund,Receiving department,Posting MDA,Officer personally,C,Posting MDA pays relocation.,psr
PSR_2021,l5-7,exam,05-Jul replacement PSR question 3,Unofficial local practice,Union-based interpretation,Correct interpretation of the PSR rule,Incorrect administrative assumption,C,Replacement question ensuring uniqueness while preserving PSR context.,psr
PSR_2021,l5-7,exam,Acting appointments fill:,Training posts,Temporarily vacant posts,Probation roles,Permanent vacancies,B,They fill temporary vacancies.,psr
PSR_2021,l5-7,exam,Acting appointment is published in the:,Local newspaper,Official Gazette,Internal memo,Union bulletin,B,They are gazetted.,psr
PSR_2021,l5-7,exam,Backdating acting appointments cannot exceed:,One year,Six months,Two years,Three months,B,Backdating is limited to six months.,psr
PSR_2021,l8-10,exam,Which body is responsible for ensuring contract appointments are based on approved waivers and identified skills?,Audit Department,Junior Staff Committee,Federal Civil Service Commission,Union Executive,C,FCSC ensures contract appointments follow approved waivers and skill requirements.,psr
PSR_2021,l8-10,exam,MDAs must defend identified skill gaps for contract appointments before:,Local HR Office,Finance Ministry,Office of the Head of the Civil Service of the Federation,National Assembly,C,Skill gaps must be defended before OHCSF.,psr
PSR_2021,l8-10,exam,Contract appointments should not jeopardize the career prospects of:,Serving officers,Consultants,Volunteers,Interns,A,Contract hiring must not harm serving officers’ career progression.,psr
PSR_2021,l8-10,exam,The purpose of posting pool officers every four years is to promote:,Salary restructuring,Employee mobility and broad experience,Punitive discipline,Union compliance,B,Regular posting enhances mobility and experience.,psr
PSR_2021,l8-10,exam,Posting decisions should avoid causing loss of:,Union membership,Office furniture,Budget allocations,Institutional memory,D,Posting must not cause loss of institutional memory.,psr
PSR_2021,l8-10,exam,MDAs rejecting deployed pool officers may face:,Promotion privileges,Automatic funding,Appropriate sanctions,Union arbitration only,C,Rejecting pool officers attracts sanctions.,psr
PSR_2021,l8-10,exam,Quarterly returns on staff transfers must be submitted to:,Union headquarters,FCSC and OHCSF,State governments,Only local HR units,B,MDAs submit returns to FCSC/OHCSF.,psr
PSR_2021,l8-10,exam,"During secondment in public interest, salary responsibility lies with:",The officer personally,Union office,Receiving agency only,The higher-paying MDA,D,The higher-paying MDA covers salary differences.,psr
PSR_2021,l8-10,exam,Transfer-on-promotion is allowed only in response to:,An advertised post,Union request,Internal memo,Verbal approval,A,Transfer-on-promotion requires an advertised vacancy.,psr
PSR_2021,l8-10,exam,Officers on secondment are treated as being on:,Suspension,Annual leave,Probation,Special duty,D,Seconded officers are treated as on special duty.,psr
PSR_2021,l8-10,exam,Posting fairness ensures the system is not used as a tool for:,Training,Performance review,Coordination,Coercion or favoritism,D,Posting must avoid coercion and favoritism.,psr
PSR_2021,l8-10,exam,Complaints about posting must follow:,Court action immediately,Informal discussion,Union protest only,Appropriate administrative channels,D,Complaints go through formal channels.,psr
PSR_2021,l8-10,exam,Relocation cost for approved posting is borne by:,Union welfare fund,The posting MDA,Receiving department only,The officer,B,Posting MDA covers relocation costs.,psr
PSR_2021,l8-10,exam,An officer requesting posting to spouse’s location bears:,Union-funded expenses,Half the cost,Relocation cost personally,No cost at all,C,Requested relocation is at officer’s expense.,psr
PSR_2021,l8-10,exam,Union tenure limits are intended to promote:,Leadership rotation,Salary increase,Reduced accountability,Permanent leadership,A,Tenure limits ensure leadership rotation.,psr
PSR_2021,l8-10,exam,Acting appointment recommendations must be forwarded using:,Transfer Form 12,Form A1,Union Memo,General Form 66,D,Acting appointments use General Form 66.,psr
PSR_2021,l8-10,exam,Gazetted acting appointments normally start from the date the officer:,Receives salary,Completes probation,Signs acceptance letter,Assumes duties,D,Commencement is when duties are assumed.,psr
PSR_2021,l8-10,exam,Extension of acting appointment beyond one year requires:,Exceptional approval,Union consent,Automatic renewal,Personal request only,A,Extensions require exceptional approval.,psr
PSR_2021,l8-10,exam,An acting officer relinquishes duties when:,Leave begins,Official handover occurs,Salary stops,Union approves,B,Relinquishment follows official handover.,psr
PSR_2021,l8-10,exam,Notification of reverting from acting appointment uses:,Transfer Sheet,Memo only,Form Gen. 15A,Form B2,C,Reversion notification uses Form Gen. 15A.,psr
PSR_2021,l8-10,exam,"As part of processing contract appointment, MDAs identify required skills via SSC and defend them at OHCSF to obtain ____.",Union certification,Automatic promotion slots,Recruitment waiver for desired skills,Pension clearance,C,Rule 020405(i) requires skill identification and defense to obtain waiver approval.,psr
PSR_2021,l8-10,exam,Contract appointment posts must be advertised in at least three national newspapers when offered to Nigerians because they possess ____.,Union tenure,Only SSCE,Specialized competencies/skills,Probation status,C,Rule 020403(v)(d) requires advertisement for specialized competencies and skills.,psr
PSR_2021,l8-10,exam,Which combination best reflects short-term engagements listed in Rule 020401?,"Audit, Procurement, Budgeting, Payroll, Treasury, Revenue","Probation, Promotion, Transfer, Posting, Suspension, Dismissal","Pension, Housing, Medical, Training, Transport, Feeding","Contract, Sabbatical, Career Exchange, Talent Sourcing, Internship, Volunteerism",D,Rule 020401 lists the categories of short-term engagements.,psr
PSR_2021,l8-10,exam,"Legal framework for short-term engagements requires representation at discussions from HR, Finance, User Dept, Legal and ____.",NYSC reps,Representation at director level,External auditors only,Union executives only,B,Rule 020421(a)(v) requires representation at the director level.,psr
PSR_2021,l8-10,exam,"After negotiations on short-term engagement, the appointment letter must be endorsed by Permanent Secretary/Chief Executive and indicate ____.",Union election results,Terms of contract by the Parties,Promotion dates,Budget vote details,B,Rule 020421(b) requires that the terms of contract be indicated.,psr
PSR_2021,l8-10,exam,"In secondment processing, furnishing confidential reports is required for ____.",Only the current year,Last three years (or whole service if less),Only probation period,Last one month only,B,Rule 020503(a) requires the last three years confidential reports or whole service if less.,psr
PSR_2021,l8-10,exam,An officer transferring from State to Federal Service shall be placed on ____.,Contract terms only,Same grade level automatically,Two grades higher,A grade level lower than current grade,D,Rule 020503(b) provides placement on a lower grade level.,psr
PSR_2021,l8-10,exam,"Secondment to another government/approved body is limited to four years total, except when it is in the ____.",Officers personal interest,Unions interest,Public interest,Budget interest,C,Rule 020503(g) allows extension if in the public interest.,psr
PSR_2021,l8-10,exam,"During secondment, non-salary allowances are paid by the ____ under Rule 020504.",FCSC,Receiving MDA,Releasing MDA,OHCSF,B,Rule 020504 assigns non-salary allowances to the receiving MDA.,psr
PSR_2021,l8-10,exam,An applicant considered for transfer must not jeopardize promotion prospects of serving officers and must have served ____.,Only 6 months in service,"Any period, no minimum",Exactly 10 years,Stipulated minimum years in grade for advertised post,D,Rule 020507(i)(d) requires stipulated minimum years in grade for promotion eligibility.,psr
PSR_2021,l8-10,exam,Posting rules prohibit posting officers to posts outside their ____.,State of origin,Age bracket,Union group,Professional cadres,D,Rule 020602(ii) prohibits posting outside professional cadres.,psr
PSR_2021,l8-10,exam,"In implementing postings, HR Directors must submit a compliance report within ____ of release of instruction.",Three days,One week,Three months,Three weeks,D,Rule 020605 sets three weeks for DHR compliance report.,psr
PSR_2021,l8-10,exam,"To keep system from being used as coercion, posting must not result in loss of institutional memory nor impair ability to ____.",Provide quality service,Avoid training,Reduce staff numbers,Increase union dues,A,Rule 020603(i) emphasizes service quality continuity.,psr
PSR_2021,l8-10,exam,A key posting safeguard is to avoid loss of an employee involved in a ____ project designated as high priority.,Service-wide,Union-led,Contract-only,Personal,A,Rule 020603(ii) protects service-wide priority projects.,psr
PSR_2021,l8-10,exam,"Under Rule 020610, labour union executives shall not be posted out of their MDAs until ____.",After salary increment,Expiration of their tenure,After confirmation,After one month,B,Rule 020610 protects executives until tenure expiration.,psr
PSR_2021,l8-10,exam,"At expiration of tenure, union executive members shall not ____ redeployment/posting/reassignment.",Decline,Gazette,Request,Recommend,A,Rule 020611 prohibits declining redeployment/posting.,psr
PSR_2021,l8-10,exam,Acting appointment is made by notice in the gazette to continue filling a duty post when no officer of corresponding substantive rank is ____.,Available for posting,On probation,A contract staff,A volunteer,A,Rule 020701 provides for acting appointment when no corresponding rank is available.,psr
PSR_2021,l8-10,exam,Acting appointment recommendations forwarded to FCSC must not exceed one year and must be gazetted; it will not be back-dated beyond ____.,Twelve months,One month,Two years,Six months,D,Rule 020704(a) limits back-dating to six months.,psr
PSR_2021,l8-10,exam,"Gazette date of commencement for acting appointment will not be earlier than when the substantive holder, after handing over, ____.",Signs union register,Completes pension form,Returns from sick leave,Leaves station/post or takes over another post or commences vacation leave,D,Rule 020705 sets conditions tied to the substantive holders status after handover.,psr
PSR_2021,l8-10,exam,Notification to FCSC for reversion from acting appointment must be forwarded not less than ____ before cessation.,Two years,Two weeks,Two days,Two months,B,Rule 020707 requires not less than two weeks before cessation.,psr
PSR_2021,l8-10,exam,MDAs defend required contract skills before:,Local HR,OHCSF,Union council,Finance ministry,B,Skill gaps are defended before OHCSF.,psr
PSR_2021,l8-10,exam,Contract hiring must not damage career prospects of:,Consultants,Interns,Volunteers,Serving officers,D,Serving officers’ careers must be protected.,psr
PSR_2021,l8-10,exam,Quarterly transfer returns are submitted to:,Union office,Audit unit,FCSC/OHCSF,State government,C,Returns go to FCSC and OHCSF.,psr
PSR_2021,l8-10,exam,Seconded officers are treated as being on:,Special duty,Probation,Suspension,Leave,A,They are treated as on special duty.,psr
PSR_2021,l8-10,exam,Transfer-on-promotion requires:,Automatic eligibility,Union approval,Director request,An advertised vacancy,D,It must respond to an advertised post.,psr
PSR_2021,l8-10,exam,Posting policy primarily supports:,Union rotation,Employee mobility,Local autonomy,Salary increase,B,Posting promotes mobility.,psr
PSR_2021,l8-10,exam,Rejecting deployed pool officers may attract:,Sanctions,Transfer,Incentives,Promotion,A,MDAs may face sanctions.,psr
PSR_2021,l8-10,exam,Receiving MDA during secondment handles:,Recruitment,Union discipline,Pension payment,Performance appraisal,D,Receiving MDA appraises performance.,psr
PSR_2021,l8-10,exam,Posting outside professional cadre is:,Union controlled,Encouraged,Optional,Prohibited,D,It is prohibited.,psr
PSR_2021,l8-10,exam,Relocation at officer’s request is paid by:,The officer,Receiving MDA,Government,Union,A,Officer bears personal relocation cost.,psr
PSR_2021,l8-10,exam,Union tenure limits promote:,Permanent leadership,Salary growth,Reduced oversight,Leadership rotation,D,They encourage rotation.,psr
PSR_2021,l8-10,exam,Acting appointment ensures:,Continuity of operations,Salary increment,Union balance,Promotion testing,A,It maintains continuity.,psr
PSR_2021,l8-10,exam,Gazetting acting appointments provides:,Local autonomy,Administrative transparency,Union authority,Budget approval,B,Gazette ensures transparency.,psr
PSR_2021,l8-10,exam,Backdating acting roles is restricted to prevent:,Training delays,Administrative abuse,Union disputes,Salary reduction,B,Restriction prevents abuse.,psr
PSR_2021,l8-10,exam,Extension of acting appointment signals:,Routine staffing,Exceptional necessity,Budget shortage,Union pressure,B,Extensions are exceptional.,psr
PSR_2021,l8-10,exam,Formal handover ensures:,Promotion,Union control,Service continuity,Financial audit,C,Handover protects continuity.,psr
PSR_2021,l8-10,exam,Posting complaints should be resolved via:,Public protest,Formal channels,Court action first,Informal talk,B,They follow official channels.,psr
PSR_2021,l8-10,exam,Strategic manpower planning depends on:,Salary budgets,Union elections,Local discretion,Accurate transfer data,D,Data supports planning.,psr
PSR_2021,l8-10,exam,Acting officer assumes:,Temporary leave,Full duties,Partial duties,Advisory role,B,They assume full responsibilities.,psr
PSR_2021,l8-10,exam,Administrative reporting strengthens:,Personal discretion,Union power,Governance oversight,Local independence,C,Reporting supports oversight.,psr
PSR_2021,l15-16,exam,Directors must approve contract engagements only when they address:,Strategic competency gaps,Temporary leave cover,Routine clerical shortages,Union demands,A,Director-level oversight ensures contracts address strategic competency gaps.,psr
PSR_2021,l15-16,exam,Director-level validation of skill waivers ensures alignment with:,Union agreements,National workforce strategy,Local staffing habits,Personal discretion,B,Waivers must align with national workforce strategy.,psr
PSR_2021,l15-16,exam,"At Director cadre, posting strategy primarily supports:",Short-term convenience,Organizational capacity building,Personal comfort,Department isolation,B,Posting enhances organizational capacity.,psr
PSR_2021,l15-16,exam,Rejecting deployed officers weakens:,Integrated manpower planning,Personal authority,Office autonomy,Local budgeting,A,It undermines integrated manpower planning.,psr
PSR_2021,l15-16,exam,Directors use quarterly transfer data to guide:,Building allocation,Salary adjustments,Strategic human resource decisions,Union negotiations,C,Transfer data informs HR strategy.,psr
PSR_2021,l15-16,exam,Director oversight of secondment ensures compliance with:,Statutory service limits,Union tolerance,Budget cycles,Personal preference,A,Secondment must follow statutory limits.,psr
PSR_2021,l15-16,exam,Receiving MDAs appraise seconded officers to maintain:,Salary equity,Union balance,Personal relationships,Performance accountability,D,Appraisal maintains accountability.,psr
PSR_2021,l15-16,exam,Fair posting frameworks at Director level protect against:,Administrative rotation,Policy compliance,Skill growth,Institutional bias,D,Fairness prevents bias.,psr
PSR_2021,l15-16,exam,Directors must enforce relocation rules to maintain:,Ad hoc decisions,Union compromise,Personal negotiation,Equitable entitlement management,D,Rules ensure equitable entitlement.,psr
PSR_2021,l15-16,exam,Monitoring union tenure limits helps Directors maintain:,Salary stability,Reduced oversight,Permanent leadership,Governance integrity,D,Tenure limits protect governance integrity.,psr
PSR_2021,l15-16,exam,Director approval of acting appointments requires:,Formal FCSC endorsement,Union clearance,Verbal consent,Internal memo,A,Acting roles need FCSC endorsement.,psr
PSR_2021,l15-16,exam,Gazetting acting roles ensures Director accountability through:,Public administrative record,Internal secrecy,Budget filing,Union documentation,A,Gazetting creates public record.,psr
PSR_2021,l15-16,exam,Certification of acting duties confirms:,Full executive responsibility,Union representation,Partial authority,Temporary assistance,A,Certification confirms full responsibility.,psr
PSR_2021,l15-16,exam,Backdating controls protect Director authority from:,Salary inflation,Procedural misuse,Administrative delay,Union conflict,B,Controls prevent misuse.,psr
PSR_2021,l15-16,exam,Extending acting appointments indicates:,Exceptional operational demand,Budget issues,Routine staffing,Union influence,A,Extensions reflect exceptional need.,psr
PSR_2021,l15-16,exam,Formal handover safeguards Director responsibility for:,Personal convenience,Union compliance,Continuity of executive control,Budget review,C,Handover maintains executive continuity.,psr
PSR_2021,l15-16,exam,Director monitoring of acting roles prevents:,Salary gaps,Training delays,Leadership stagnation,Union disputes,C,Monitoring prevents stagnation.,psr
PSR_2021,l15-16,exam,Administrative reporting strengthens Director capacity for:,Local autonomy,Central governance oversight,Union independence,Personal discretion,B,Reporting supports oversight.,psr
PSR_2021,l15-16,exam,Director-led posting aligns with:,Union request,Personal preference,Employee mobility framework,Local politics,C,Posting follows mobility framework.,psr
PSR_2021,l15-16,exam,Handling posting complaints at Director level requires:,Informal negotiation,Union mediation only,Formal administrative adjudication,Personal discretion,C,Complaints require formal adjudication.,psr
PSR_2021,l15-16,exam,"As Director cadre, which control best ensures contract appointments strengthen institutional capacity rather than create dependency?",Waiving advertisement routinely,Requiring mentoring of serving officers as part of contract duties,Ignoring waiver process,Allowing contract officers to avoid appraisal,B,Rule 020406(i) requires contract officers to mentor serving officers.,psr
PSR_2021,l15-16,exam,A Director assessing contract re-engagement should ensure recommendation includes an up-to-date confidential report unless sent within ____.,Previous two months,Previous six months,Previous two weeks,Previous one year,A,Rule 020409 requires an up-to-date confidential report unless forwarded within the previous two months.,psr
PSR_2021,l15-16,exam,Director-level compliance on postings requires DHR to submit a compliance report within three weeks; this supports ____.,Governance and implementation control,Probation confirmation,Union tenure extension,Automatic relocation claims,A,Rule 020605 sets compliance reporting to enforce implementation.,psr
PSR_2021,l15-16,exam,"From a Director perspective, which posting safeguard mitigates operational risk to critical initiatives?",Posting only junior staff,Posting without criteria,Protecting staff assigned to high-priority service-wide projects,Posting all staff simultaneously,C,Rule 020603(ii) protects high priority projects.,psr
PSR_2021,l15-16,exam,Which leadership responsibility ensures fair and lawful interpretation of contract terms at Director level?,Ignoring ambiguous clauses,Delegating to union executives,Referring interpretation disputes to OHCSF,Allowing each MDA to decide independently,C,Rule 020404(i) assigns interpretation authority to OHCSF.,psr
PSR_2021,l15-16,exam,A Director managing volunteer engagement must prioritize which safeguard to reduce institutional risk?,Union recommendation only,Verbal supervisor approval,Medical fitness certification and police security clearance,Budget approval only,C,Rule 020417(iv) requires medical fitness and police clearance.,psr
PSR_2021,l15-16,exam,"To preserve service delivery standards, Directors must avoid postings that result in ____.",Temporary inconvenience to staff,Loss of institutional memory affecting quality service,Short-term travel costs,Routine administrative delays,B,Rule 020603(i) protects service continuity.,psr
PSR_2021,l15-16,exam,"In secondment governance, Directors must ensure salary responsibility aligns with ____.",Officers personal arrangement,Automatic equal sharing,Union agreement,Higher-paying MDA in public interest differential cases,D,Rule 020504 assigns salary to the higher-paying MDA in differential cases.,psr
PSR_2021,l15-16,exam,Which control mechanism ensures transparency in acting appointments at Director level?,Email announcement,Union notification,Formal gazetting through FCSC/Board,Internal memo circulation,C,Rules 020701 and 020704 require gazette notice.,psr
PSR_2021,l15-16,exam,Directors must prevent acting appointments from being misused as ____.,A disciplinary tool,A test for promotion suitability,A salary enhancement scheme,A reward for loyalty,B,Rule 020703 prohibits using acting roles as promotion tests.,psr
PSR_2021,l15-16,exam,The maximum acting appointment duration before exceptional extension is ____.,Three years,One year,Six months,Two years,B,Rule 020704(b) sets one year before possible extension.,psr
PSR_2021,l15-16,exam,Restriction on back-dating acting appointments primarily protects against ____.,Contract disputes,Union interference,Salary disputes,Administrative abuse and delayed reporting,D,Rule 020704(a) limits back-dating to prevent abuse.,psr
PSR_2021,l15-16,exam,Quarterly reporting on transfers and secondments supports Directors in achieving ____.,Training scheduling,Local budgeting autonomy,Central manpower oversight,Union coordination,C,Rule 020509 promotes central oversight.,psr
PSR_2021,l15-16,exam,Transfer-on-promotion governance requires that movement occur only through ____.,Response to advertised vacancies,Union negotiation,Automatic rotation,Director recommendation alone,A,Rule 020506 restricts transfer-on-promotion to advertised posts.,psr
PSR_2021,l15-16,exam,Directors must obtain approval before seconding senior officers to supervised parastatals from ____.,FCSC/Board,Budget office,Receiving organization,Union leadership,A,Rule 020507(ii) requires FCSC/Board approval.,psr
PSR_2021,l15-16,exam,Acceptance of seconded officers becomes valid only after ____.,Union acknowledgment,Endorsement by FCSC/Board,Local HR approval,Email confirmation,B,Rule 020507(iii) mandates endorsement.,psr
PSR_2021,l15-16,exam,Timely notification of reversion from acting appointment ensures ____.,Union compliance,Budget savings,Immediate promotion,Orderly leadership transition,D,Rule 020707 ensures orderly transition planning.,psr
PSR_2021,l15-16,exam,"When a departmental head is absent for one month, Directors maintain stability by assigning oversight to ____.",An external consultant,Union representatives,A rotating committee,The most senior officer available,D,Rule 020708(b) preserves operational continuity.,psr
PSR_2021,l15-16,exam,Director-level posting decisions must primarily balance fairness with ____.,Cost reduction,Staff convenience,Continuity of public service delivery,Union expectations,C,Rule 020603 emphasizes fairness and service continuity.,psr
PSR_2021,l15-16,exam,Effective contract governance at Director level requires ensuring contracts include duties to ____.,Avoid performance reviews,Limit internal promotions,Bypass HR procedures,Transfer knowledge to permanent staff,D,Rule 020406(i) emphasizes mentoring and knowledge transfer.,psr
PSR_2021,l15-16,exam,Director-level approval of contract appointments must prioritize:,Local convenience,Strategic institutional needs,Union demands,Personal preference,B,Directors must align contracts with strategic institutional needs.,psr
PSR_2021,l15-16,exam,Directors must ensure contract officers contribute to:,Capacity building of permanent staff,Budget reduction,Union leadership,Temporary staffing only,A,Contract officers should build internal capacity.,psr
PSR_2021,l15-16,exam,Oversight of manpower gaps at Director level focuses on:,Long-term workforce sustainability,Union balance,Short-term convenience,Local autonomy,A,Directors focus on sustainable workforce planning.,psr
PSR_2021,l15-16,exam,Rejecting deployed officers undermines:,Office independence,Salary administration,Training programs,Integrated manpower coordination,D,It disrupts coordinated manpower planning.,psr
PSR_2021,l15-16,exam,Directors rely on quarterly staffing data to guide:,Travel approvals,Strategic HR decisions,Office decoration,Union elections,B,Data informs strategic HR planning.,psr
PSR_2021,l15-16,exam,15-16 replacement PSR question 6,Incorrect administrative assumption,Unofficial local practice,Correct interpretation of the PSR rule,Union-based interpretation,C,Replacement question ensuring uniqueness while preserving PSR context.,psr
PSR_2021,l15-16,exam,Performance accountability of seconded officers is maintained by:,External auditors,Union supervision,Personal reporting,Receiving MDA appraisal,D,Receiving MDAs appraise performance.,psr
PSR_2021,l15-16,exam,Fair posting frameworks at Director level prevent:,Skill rotation,Institutional bias,Routine transfer,Administrative growth,B,Fairness prevents bias.,psr
PSR_2021,l15-16,exam,Directors enforce relocation policies to maintain:,Personal negotiation,Union compromise,Ad hoc decisions,Equitable entitlement management,D,Rules ensure equitable entitlements.,psr
