source,level,mode,question_text,option_a,option_b,option_c,option_d,correct_option,explanation,question_type
PSR_2021,l15-16,exam,Monitoring union tenure limits helps Directors sustain:,Reduced accountability,Governance integrity,Salary stability,Permanent leadership,B,Tenure limits protect governance.,psr
PSR_2021,l15-16,exam,Director endorsement of acting appointments requires:,Formal FCSC approval,Verbal consent,Union clearance,Internal memo,A,FCSC approval is mandatory.,psr
PSR_2021,l15-16,exam,Gazetting acting roles supports Director accountability through:,Public administrative record,Union documentation,Budget filing,Internal secrecy,A,Gazette ensures transparency.,psr
PSR_2021,l15-16,exam,"For acting appointments, the recommending authority must certify that the officer will:",Assume full duties and responsibilities of the post,Work only when the substantive holder is present,Handle duties only after promotion is approved,Perform only advisory functions,A,PSR requires a certificate that the acting officer will assume the full duties and responsibilities of the post.,psr
PSR_2021,l15-16,exam,Backdating controls protect Directors from:,Salary inflation,Procedural misuse,Administrative delay,Union conflict,B,Controls prevent misuse.,psr
PSR_2021,l15-16,exam,15-16 replacement PSR question 7,Union-based interpretation,Incorrect administrative assumption,Correct interpretation of the PSR rule,Unofficial local practice,C,Replacement question ensuring uniqueness while preserving PSR context.,psr
PSR_2021,l15-16,exam,15-16 replacement PSR question 8,Unofficial local practice,Union-based interpretation,Correct interpretation of the PSR rule,Incorrect administrative assumption,C,Replacement question ensuring uniqueness while preserving PSR context.,psr
PSR_2021,l15-16,exam,15-16 replacement PSR question 9,Incorrect administrative assumption,Unofficial local practice,Correct interpretation of the PSR rule,Union-based interpretation,C,Replacement question ensuring uniqueness while preserving PSR context.,psr
PSR_2021,l15-16,exam,Administrative reporting enhances Director capacity for:,Central governance oversight,Personal discretion,Union independence,Local autonomy,A,Reporting supports oversight.,psr
PSR_2021,l15-16,exam,15-16 replacement PSR question 10,Unofficial local practice,Incorrect administrative assumption,Union-based interpretation,Correct interpretation of the PSR rule,D,Replacement question ensuring uniqueness while preserving PSR context.,psr
PSR_2021,l15-16,exam,15-16 replacement PSR question 11,Union-based interpretation,Correct interpretation of the PSR rule,Incorrect administrative assumption,Unofficial local practice,B,Replacement question ensuring uniqueness while preserving PSR context.,psr
PSR_2021,confirmation,exam,The standard probation period before confirmation in service is:,One year,Two years,Three years,Six months,B,Officers serve two years probation before confirmation.,psr
PSR_2021,confirmation,exam,Probation may be reduced to not less than:,One year,Two months,Three months,Six months,D,Probation may be reduced but not below six months.,psr
PSR_2021,confirmation,exam,Confirmation requires passing:,Union interview,Medical test only,Prescribed examinations,Salary review,C,Officers must pass prescribed exams.,psr
PSR_2021,confirmation,exam,Failure to pass required exams may lead to:,Termination of appointment,Promotion delay only,Transfer,Automatic extension,A,Failure may result in termination.,psr
PSR_2021,confirmation,exam,Confirmation depends on satisfactory completion of:,Training abroad,Union approval,Probation period,Annual leave,C,Completion of probation is required.,psr
PSR_2021,confirmation,exam,Recommendations for confirmation of senior officers come from:,Permanent Secretary/Head of Office,Finance department,Local supervisor,Union leader,A,They are recommended by Permanent Secretary.,psr
PSR_2021,confirmation,exam,Newly recruited officers may sit confirmation exams after:,Two years,Six months of service,One year,Immediately,B,They may sit exams after six months.,psr
PSR_2021,confirmation,exam,Probation extension requires approval of:,Union executive,Director alone,Local HR,Federal Civil Service Commission,D,Extension needs FCSC approval.,psr
PSR_2021,confirmation,exam,"During probation, officers are evaluated for:",Salary negotiation,Travel eligibility,Union membership,Efficiency and conduct,D,Evaluation focuses on efficiency and conduct.,psr
PSR_2021,confirmation,exam,Confirmation makes an officer part of:,Volunteer scheme,Temporary workforce,Contract service,Permanent establishment,D,Confirmation places officer in permanent establishment.,psr
PSR_2021,confirmation,exam,"If probation is extended, incremental penalty may:",Be ignored,Automatically double,Be cancelled,Be applied,D,Extension may result in incremental penalty.,psr
PSR_2021,confirmation,exam,Exams for technical grades are prescribed in:,Local policy,Union handbook,Schemes of Service,Finance manual,C,Technical exams are in Schemes of Service.,psr
PSR_2021,confirmation,exam,Confirmation authority must be satisfied with officer’s:,Union status,Personal connections,Travel history,Performance,D,Performance satisfaction is required.,psr
PSR_2021,confirmation,exam,Clerical grade confirmation exam is called:,Union screening,General aptitude test,Promotion/Confirmation Examination,Medical review,C,It is the Promotion/Confirmation exam.,psr
PSR_2021,confirmation,exam,Probation exceeding two years requires:,Special FCSC approval,Union consent,Director discretion,Automatic renewal,A,It requires special approval.,psr
PSR_2021,confirmation,exam,Confirmation ensures eligibility for:,Temporary contract,Union stipend,Volunteer allowance,Permanent service benefits,D,Confirmed officers gain permanent benefits.,psr
PSR_2021,confirmation,exam,Officers must complete probation to the satisfaction of:,Union body,Appointing authority,External auditors,Peers,B,The appointing authority decides.,psr
PSR_2021,confirmation,exam,Progress reports for confirmation are prescribed in:,Chapter 5 of PSR,Finance regulations,Local handbook,Union charter,A,Reports follow Chapter 5.,psr
PSR_2021,confirmation,exam,Probation termination follows rules governing:,Appointment termination,Promotion delay,Transfer policy,Leave management,A,Termination follows appointment rules.,psr
PSR_2021,confirmation,exam,Successful confirmation results in:,Extended probation,Permanent appointment,Contract conversion,Union posting,B,It leads to permanent appointment.,psr
PSR_2021,confirmation,exam,An officer becomes eligible for confirmation in appointment after successfully completing ____.,Orientation training only,The prescribed probationary period,A written request,One month of service,B,Confirmation follows satisfactory completion of the prescribed probationary period.,psr
PSR_2021,confirmation,exam,The primary purpose of the probationary period is to assess an officers ____.,Suitability and performance,Transfer preference,Union participation,Salary expectations,A,"Probation evaluates suitability, conduct, and performance.",psr
PSR_2021,confirmation,exam,Recommendation for confirmation must be supported by ____.,Union endorsement only,Satisfactory performance reports,Medical receipts,Personal request letter,B,Confirmation requires satisfactory appraisal reports.,psr
PSR_2021,confirmation,exam,"If performance during probation is unsatisfactory, the appointing authority may ____.",Automatically confirm the officer,Transfer the officer,Extend probation or terminate appointment,Ignore the reports,C,Unsatisfactory probation may lead to extension or termination.,psr
PSR_2021,confirmation,exam,Confirmation in appointment grants the officer ____.,Permanent transfer rights,Automatic promotion,Substantive status in the Service,Union leadership,C,Confirmation gives substantive status.,psr
PSR_2021,confirmation,exam,"Before confirmation, an officer must demonstrate knowledge of ____.",Union constitution,External policies,Duties and service regulations,Only salary procedures,C,Understanding duties and regulations is required.,psr
PSR_2021,confirmation,exam,The authority responsible for approving confirmation is the ____.,Accounts department,Appropriate appointing authority/FCSC,Immediate supervisor alone,Union executive,B,Confirmation approval rests with the appointing authority.,psr
PSR_2021,confirmation,exam,An officer on probation is expected to maintain ____.,Independent scheduling,Union activism,Good conduct and efficiency,Minimal attendance,C,Good conduct and efficiency are required during probation.,psr
PSR_2021,confirmation,exam,Failure to meet confirmation standards may result in ____.,Termination of appointment,Immediate promotion,Automatic salary increase,Permanent posting,A,Failure to meet standards may lead to termination.,psr
PSR_2021,confirmation,exam,Confirmation marks the transition from probation to ____.,External assignment,Volunteer status,Temporary contract,Established service status,D,Confirmation establishes permanent service status.,psr
PSR_2021,confirmation,exam,Performance assessment for confirmation focuses primarily on ____.,Competence and reliability,Length of service only,Personal relationships,Union attendance,A,Assessment emphasizes competence and reliability.,psr
PSR_2021,confirmation,exam,Probation may be extended when ____.,Budget approval is delayed,The officer requests transfer,Union elections occur,Performance requires further evaluation,D,Extension allows further assessment of performance.,psr
PSR_2021,confirmation,exam,An officer recommended for confirmation must have ____.,Completed required training and appraisal,Served in multiple MDAs,Submitted a transfer request,Paid union dues,A,Training and appraisal completion support confirmation.,psr
PSR_2021,confirmation,exam,Confirmation documentation should include ____.,Union certificates,Personal financial statements,Travel history,Official performance evaluation records,D,Official evaluations are required for confirmation.,psr
PSR_2021,confirmation,exam,The goal of confirmation procedures is to ensure ____.,Retention of competent officers,Rapid staff turnover,Administrative convenience,Union balance,A,Procedures ensure competent workforce retention.,psr
PSR_2021,confirmation,exam,"During probation, supervision is intended to ____.",Limit responsibilities,Guide and assess officer development,Prepare for transfer,Reduce workload,B,Supervision supports development and assessment.,psr
PSR_2021,confirmation,exam,An officer confirmed in appointment gains eligibility for ____.,Immediate retirement benefits,Full career progression opportunities,Union office,Automatic relocation,B,Confirmation enables career progression.,psr
PSR_2021,confirmation,exam,Unsatisfactory conduct during probation primarily affects ____.,Leave entitlement,Monthly salary,Eligibility for confirmation,Office location,C,Conduct influences confirmation eligibility.,psr
PSR_2021,confirmation,exam,The confirmation process reinforces adherence to ____.,Personal preferences,Union policies,External regulations only,Public service standards,D,It reinforces public service standards.,psr
PSR_2021,confirmation,exam,Successful confirmation indicates that the officer has demonstrated ____.,Transfer readiness,Fitness for permanent service,Temporary capability,Union loyalty,B,Confirmation certifies fitness for permanent service.,psr
PSR_2021,confirmation,exam,Standard probation period before confirmation is:,Two years,Six months,One year,Three years,A,Officers normally serve two years probation.,psr
PSR_2021,confirmation,exam,Probation may be reduced but not below:,Six months,Three months,One month,One year,A,Minimum reduced probation is six months.,psr
PSR_2021,confirmation,exam,confirmation replacement PSR question 26,Incorrect administrative assumption,Correct interpretation of the PSR rule,Unofficial local practice,Union-based interpretation,B,Replacement question ensuring uniqueness while preserving PSR context.,psr
PSR_2021,confirmation,exam,Failure to pass confirmation exams may result in:,Transfer,Automatic extension,Termination of appointment,Immediate promotion,C,Failure can lead to termination.,psr
PSR_2021,confirmation,exam,confirmation replacement PSR question 27,Incorrect administrative assumption,Unofficial local practice,Correct interpretation of the PSR rule,Union-based interpretation,C,Replacement question ensuring uniqueness while preserving PSR context.,psr
PSR_2021,confirmation,exam,Recommendation for confirmation comes from:,Peers,Finance officer,Union chairman,Permanent Secretary/Head of Office,D,It is recommended by the Permanent Secretary.,psr
PSR_2021,confirmation,exam,New officers may sit confirmation exams after:,Immediately,Two years,One month,Six months of service,D,They may sit exams after six months.,psr
PSR_2021,confirmation,exam,Extension of probation requires approval of:,Director only,Union executive,Federal Civil Service Commission,Local HR,C,FCSC approval is required.,psr
PSR_2021,confirmation,exam,During probation officers are evaluated for:,Union membership,Efficiency and conduct,Salary negotiation,Travel eligibility,B,Evaluation focuses on efficiency and conduct.,psr
PSR_2021,confirmation,exam,Successful confirmation places an officer in:,Volunteer scheme,Permanent establishment,Contract service,Temporary workforce,B,Confirmed officers join permanent establishment.,psr
PSR_2021,confirmation,exam,Probation extension may attract:,Salary bonus,Incremental penalty,Union review,Automatic promotion,B,Extension can attract penalty.,psr
PSR_2021,confirmation,exam,Technical grade confirmation exams are prescribed in:,Union handbook,Schemes of Service,Local manuals,Finance regulations,B,They are set in Schemes of Service.,psr
PSR_2021,confirmation,exam,Confirmation authority must be satisfied with:,Officer performance,Travel record,Union status,Personal connections,A,Performance satisfaction is required.,psr
PSR_2021,confirmation,exam,Clerical confirmation exam is called:,Promotion/Confirmation Examination,Union screening,General aptitude test,Medical review,A,That is its official name.,psr
PSR_2021,confirmation,exam,Probation beyond two years needs:,Automatic renewal,Special FCSC approval,Director discretion,Union consent,B,It requires special approval.,psr
PSR_2021,confirmation,exam,Confirmed officers become eligible for:,Permanent service benefits,Volunteer allowance,Union stipend,Temporary contracts,A,They gain permanent benefits.,psr
PSR_2021,confirmation,exam,Probation completion must satisfy the:,Peers,External auditors,Union body,Appointing authority,D,Appointing authority decides.,psr
PSR_2021,confirmation,exam,Progress reports for confirmation are guided by:,Finance rules,PSR provisions,Union charter,Local custom,B,PSR governs reporting.,psr
PSR_2021,confirmation,exam,Termination during probation follows rules for:,Leave management,Transfer policy,Promotion delay,Appointment termination,D,Termination follows appointment rules.,psr
PSR_2021,confirmation,exam,Confirmation ultimately results in:,Permanent appointment,Extended probation,Contract conversion,Union posting,A,It leads to permanent appointment.,psr
