source,level,mode,question_text,option_a,option_b,option_c,option_d,correct_option,explanation,question_type
PSR_2021,l12-14,exam,Relocation entitlements must follow:,Union negotiation,Established service rules,Officer preference,Manager discretion,B,Rules govern entitlements.,psr
PSR_2021,l12-14,exam,Union tenure limits support:,Governance stability,Budget efficiency,Reduced oversight,Permanent leadership,A,They promote stable governance.,psr
PSR_2021,l12-14,exam,Acting appointments require:,Internal memo only,Verbal agreement,Formal FCSC authorization,Union approval,C,FCSC authorization is mandatory.,psr
PSR_2021,l12-14,exam,Gazetting acting roles ensures:,Administrative transparency,Budget approval,Union authority,Local secrecy,A,Gazette provides transparency.,psr
PSR_2021,l12-14,exam,Dec-14 replacement PSR question 4,Unofficial local practice,Incorrect administrative assumption,Correct interpretation of the PSR rule,Union-based interpretation,C,Replacement question ensuring uniqueness while preserving PSR context.,psr
PSR_2021,l12-14,exam,Backdating restrictions exist to prevent:,Training delays,Union disputes,Administrative abuse,Salary reduction,C,They prevent misuse.,psr
PSR_2021,l12-14,exam,Extension of acting appointments indicates:,Budget shortage,Exceptional operational necessity,Routine staffing,Union influence,B,Extensions are exceptional.,psr
PSR_2021,l12-14,exam,Formal handover procedures guarantee:,Continuity of service,Financial review,Union compliance,Promotion,A,Handover ensures continuity.,psr
PSR_2021,l12-14,exam,Monitoring acting roles prevents:,Union imbalance,Leadership stagnation,Skill growth,Salary inflation,B,Oversight avoids stagnation.,psr
PSR_2021,l12-14,exam,Dec-14 replacement PSR question 5,Incorrect administrative assumption,Correct interpretation of the PSR rule,Unofficial local practice,Union-based interpretation,B,Replacement question ensuring uniqueness while preserving PSR context.,psr
PSR_2021,l12-14,exam,Posting strategy must align with:,Employee mobility framework,Union request,Personal preference,Local politics,A,Posting follows mobility policy.,psr
PSR_2021,l12-14,exam,Senior management oversight ensures compliance with:,Public service regulations,Local customs,Personal judgment,Union directives,A,Oversight enforces PSR compliance.,psr
PSR_2021,l1-4,exam,Minimum period an officer must serve before seeking transfer to another post is:,One year,Six months,Two years,Three months,B,PSR requires an officer to serve at least six months before seeking transfer.,psr
PSR_2021,l1-4,exam,Contract appointment in the Public Service is primarily:,Volunteer service,Probationary service,Temporary and non‑pensionable,Permanent and pensionable,C,A contract appointment is temporary and does not provide pension.,psr
PSR_2021,l1-4,exam,The minimum grade level for contract appointment is:,SGL 15,SGL 05,SGL 07,SGL 12,D,Contract appointments must not be below SGL 12.,psr
PSR_2021,l1-4,exam,Maximum total duration of a renewable contract appointment is:,Two years,Six years,One year,Four years,D,Contract appointments may be renewed but not beyond four years total.,psr
PSR_2021,l1-4,exam,Contract officers must mentor:,External consultants,Interns only,Serving officers,Volunteers,C,Contract officers are required to mentor serving officers.,psr
PSR_2021,l1-4,exam,An officer seeking re‑engagement must notify government at least:,Six weeks before leave,One month before leave,Four months before leave,Immediately after leave,C,Notification for re‑engagement must be given at least four months in advance.,psr
PSR_2021,l1-4,exam,Internship maximum full‑time duration is:,6 months,3 months,12 months,24 months,C,Interns may be engaged full‑time for not more than 12 months.,psr
PSR_2021,l1-4,exam,Volunteers may be engaged for a maximum of:,3 months,2 years,12 months,6 months,C,Volunteer engagement is limited to 12 months.,psr
PSR_2021,l1-4,exam,Transfer means:,Probation,Promotion,Permanent release to another service,Temporary posting,C,Transfer is the permanent release of an officer to another service.,psr
PSR_2021,l1-4,exam,Secondment is defined as:,Dismissal,Temporary release to another body,Permanent retirement,Promotion,B,Secondment is a temporary release to another approved organization.,psr
PSR_2021,l1-4,exam,Secondment initial maximum period is:,Six months,One year,Two years,Four years,C,Initial secondment is for a maximum of two years.,psr
PSR_2021,l1-4,exam,Posting primarily helps officers to:,Avoid promotion,Reduce workload,Earn bonuses,Gain wide experience,D,Posting exposes officers to different areas of service.,psr
PSR_2021,l1-4,exam,Refusal to proceed on posting is regarded as:,Transfer,Leave,Misconduct,Promotion,C,Failure to proceed on posting is treated as misconduct.,psr
PSR_2021,l1-4,exam,Posting complaints must be submitted within:,Two weeks,Three working days,One month,One week,B,Complaints must be lodged within three working days.,psr
PSR_2021,l1-4,exam,The posting MDA bears the cost of:,Housing loans,Training abroad,Medical bills,Relocation entitlements,D,The posting MDA pays relocation entitlements.,psr
PSR_2021,l1-4,exam,Acting appointment requires approval of:,Federal Civil Service Commission,Local committee,Union leader,Any supervisor,A,Acting appointments require FCSC approval.,psr
PSR_2021,l1-4,exam,Acting appointment is not meant to:,Test suitability for promotion,Fill temporary vacancy,Support operations,Ensure continuity,A,It is not a trial for promotion.,psr
PSR_2021,l1-4,exam,Normal maximum acting appointment period is:,Six months,One year,Three years,Two months,B,Acting appointments normally do not exceed one year.,psr
PSR_2021,l1-4,exam,Interns must provide:,Union card,Medical insurance,Reference letter from institution,Passport,C,Interns submit institutional reference letters.,psr
PSR_2021,l1-4,exam,Volunteers must obtain:,Promotion letter,Union approval,Police security clearance,Travel visa,C,Volunteers require police security clearance.,psr
PSR_2021,l1-4,exam,PSR requires a minimum of ____ in a post before an officer may seek transfer.,Three (3) months,Two (2) years,One (1) year,Six (6) months,D,Rule 020307 requires at least six months in the original post before seeking transfer.,psr
PSR_2021,l1-4,exam,A contract appointment is best described as a ____ appointment.,"Volunteer, unpaid","Probationary, pensionable","Temporary, non-pensionable","Permanent, pensionable",C,Rule 020402 defines contract appointment as temporary and non-pensionable.,psr
PSR_2021,l1-4,exam,"Under PSR, the minimum level for a contract appointment post is ____.",SGL 06,SGL 15,GL 07,SGL 12,D,Rule 020405(iii) states the post must not be below SGL 12.,psr
PSR_2021,l1-4,exam,Maximum total period for renewable contract appointment is ____.,Two (2) years,Six (6) years,Four (4) years,One (1) year,C,Rule 020405(vii) caps renewals to four years in all.,psr
PSR_2021,l1-4,exam,An officer on secondment keeps his substantive post and is treated as posted on ____.,Probation,Suspension,Casual leave,Special duty,D,Rule 020503(h) treats the officer as posted on special duty.,psr
PSR_2021,l1-4,exam,Interns engaged full-time may serve for not more than ____.,6 months,24 months,3 months,12 months,D,Rule 020418 limits full-time internship to not more than 12 months.,psr
PSR_2021,l1-4,exam,Volunteer engagement in the Federal Service is limited to a maximum of ____ at a time.,18 months,6 months,12 months,24 months,C,Rule 020418 sets volunteers to a maximum of 12 months at a time.,psr
PSR_2021,l1-4,exam,Posting is defined as initial assignment or ____ of an officer to another job schedule.,Retirement,Dismissal,Reassignment,Confirmation,C,Rule 020601 defines posting to include reassignment.,psr
PSR_2021,l1-4,exam,Failure of an officer to proceed on posting is regarded as ____.,Misconduct,Commendation,Promotion,A transfer,A,Rule 020602 treats failure to proceed on posting as misconduct.,psr
PSR_2021,l1-4,exam,Acting appointment is not intended as a means of testing suitability for ____.,Secondment,Posting,Promotion,Transfer,C,Rule 020703 states acting appointment is not a trial for promotion.,psr
PSR_2021,l1-4,exam,Recommendations for acting appointment are forwarded on ____.,FCSC Form 2,Form Gen. 15A,Form Gen. 60,General Form 66,D,Rule 020704(a) requires General Form 66 for acting appointment recommendations.,psr
PSR_2021,l1-4,exam,Back-dating of an acting appointment cannot exceed ____ from date of receipt of recommendation.,Two (2) years,Three (3) months,One (1) year,Six (6) months,D,Rule 020704(a) limits back-dating to not more than six months.,psr
PSR_2021,l1-4,exam,Posting complaints should be submitted within ____ of release of posting instruction.,One month,Seven working days,Three working days,Two weeks,C,Rule 020606 requires complaints within three working days.,psr
PSR_2021,l1-4,exam,The cost of entitlements due to an employee whose posting changes duty station is borne by the ____.,Officer personally in all cases,Union office,Receiving MDA,Posting MDA,D,Rule 020607 places the cost on the posting MDA.,psr
PSR_2021,l1-4,exam,An officer requesting posting to spouses location: Government shall ____ bear relocation cost.,not,always,only if union approves,partly,A,Rule 020608 states Government is not responsible for relocation when posting is at officers request.,psr
PSR_2021,l1-4,exam,Secondment in the first instance shall be for a maximum period of ____.,Six (6) months,Two (2) years,One (1) year,Four (4) years,B,Rule 020503(f) provides two years in the first instance.,psr
PSR_2021,l1-4,exam,Total period of secondment (normal rule) must not exceed ____.,Two (2) years,Eight (8) years,Six (6) years,Four (4) years,D,Rule 020503(f) caps total at four years.,psr
PSR_2021,l1-4,exam,MDAs shall submit returns on transfer/secondment on a ____ basis.,Monthly,Annual,Quarterly,Bi-annual,C,Rule 020509 provides for quarterly returns.,psr
PSR_2021,l1-4,exam,A contract officer must sign the oath of secrecy in line with PSR ____.,20601,20503,20307,20210,D,Rule 020406(iv) references PSR 020210 for oath of secrecy.,psr
PSR_2021,l1-4,exam,"To be engaged as a volunteer, prospective volunteers must obtain security clearance from the ____.",Police,FCSC,OHCSF,National Assembly,A,Rule 020417(iv) requires police security clearance.,psr
PSR_2021,l1-4,exam,Minimum service period before transfer is:,Three months,Six months,Two years,One year,B,PSR requires six months minimum before transfer.,psr
PSR_2021,l1-4,exam,Contract appointment is classified as:,Permanent,Temporary and non‑pensionable,Volunteer,Probationary,B,Contract appointments are temporary and non‑pensionable.,psr
PSR_2021,l1-4,exam,Lowest grade allowed for contract appointment:,GL 05,SGL 12,SGL 07,SGL 15,B,Posts must not be below SGL 12.,psr
PSR_2021,l1-4,exam,Maximum total renewable contract duration:,Two years,One year,Six years,Four years,D,Contract may not exceed four years total.,psr
PSR_2021,l1-4,exam,01-May replacement PSR question 1,Correct interpretation of the PSR rule,Incorrect administrative assumption,Unofficial local practice,Union-based interpretation,A,Replacement question ensuring uniqueness while preserving PSR context.,psr
PSR_2021,l1-4,exam,Re-engagement notice period is:,Two weeks,One month,Six months,Four months,D,Notice must be given four months before leave.,psr
PSR_2021,l1-4,exam,Full-time internship maximum duration:,12 months,3 months,18 months,6 months,A,Internship may last up to 12 months.,psr
PSR_2021,l1-4,exam,Volunteer maximum engagement:,12 months,6 months,3 months,24 months,A,Volunteer service is limited to 12 months.,psr
PSR_2021,l1-4,exam,01-May replacement PSR question 2,Unofficial local practice,Union-based interpretation,Correct interpretation of the PSR rule,Incorrect administrative assumption,C,Replacement question ensuring uniqueness while preserving PSR context.,psr
PSR_2021,l1-4,exam,Secondment means:,Temporary release,Promotion,Probation,Dismissal,A,Secondment is temporary release.,psr
PSR_2021,l1-4,exam,Initial secondment period:,Six months,Two years,One year,Four years,B,First secondment is two years.,psr
PSR_2021,l1-4,exam,Posting is defined as:,Assignment or reassignment,Retirement,Discipline,Promotion,A,Posting involves assignment/reassignment.,psr
PSR_2021,l1-4,exam,Refusal to proceed on posting is:,Promotion,Reward,Misconduct,Leave,C,Refusal is misconduct.,psr
PSR_2021,l1-4,exam,Posting complaints time limit:,Two weeks,Three working days,One month,One week,B,Complaints must be filed within three days.,psr
PSR_2021,l1-4,exam,Relocation cost is paid by:,Union,Receiving staff,Posting MDA,Officer,C,Posting MDA bears relocation cost.,psr
PSR_2021,l1-4,exam,Acting appointment approval comes from:,Union,Finance office,FCSC,Local supervisor,C,FCSC approves acting appointment.,psr
PSR_2021,l1-4,exam,Acting appointment is not for:,Testing promotion suitability,Temporary vacancy,Continuity,Duty coverage,A,It is not a promotion test.,psr
PSR_2021,l1-4,exam,Normal acting appointment duration:,Six months,Three months,Two years,One year,D,Standard acting period is one year.,psr
PSR_2021,l1-4,exam,Interns must present:,Passport,Institutional reference,Union card,Medical insurance,B,Reference letter is required.,psr
PSR_2021,l1-4,exam,Volunteers require:,Police clearance,Promotion letter,Visa,Union approval,A,Police security clearance is required.,psr
PSR_2021,l5-7,exam,Which authority must approve transfer from one senior post to another?,Federal Civil Service Commission,Immediate Supervisor,Junior Staff Committee,Union Executive,A,Transfer between senior posts requires approval of the Federal Civil Service Commission.,psr
PSR_2021,l5-7,exam,An application for transfer must be submitted through the:,Local government council,Finance department,Union office,Permanent Secretary or Head of Extra‑Ministerial Office,D,Transfer applications are routed through the Permanent Secretary or Head of Extra‑Ministerial Office.,psr
PSR_2021,l5-7,exam,Contract appointments are mainly used to address:,Routine annual leave,Staff retirement,Office relocation,Gaps in specialized skills,D,They are used to fill gaps in specialized or emerging skills.,psr
PSR_2021,l5-7,exam,Selection for contract appointment must be based on:,Personal recommendation,Merit and competitive process,Seniority alone,Union nomination,B,Contract appointments must follow a fair and competitive merit-based process.,psr
PSR_2021,l5-7,exam,Questions about interpretation of contract terms should be referred to:,Local HR unit,Union council,Finance Ministry,Office of the Head of the Civil Service of the Federation,D,Interpretation of contracts is referred to OHCSF.,psr
PSR_2021,l5-7,exam,A contract officer is required to accept posting to:,Only their home state,Headquarters only,Any part of the country,Urban areas only,C,Contract officers must accept posting anywhere in the country.,psr
PSR_2021,l5-7,exam,Failure to notify intention for re‑engagement implies the officer:,Is promoted,Is dismissed,Does not desire re‑engagement,Is automatically renewed,C,Lack of notification is assumed to mean no interest in re‑engagement.,psr
PSR_2021,l5-7,exam,Re‑engagement requires consent from:,Union executive,State government,Audit department,Office of the Head of the Civil Service of the Federation,D,OHCSF consent is required before forwarding recommendation.,psr
PSR_2021,l5-7,exam,Internship programs are primarily meant to:,Test retirement policy,Replace permanent staff,Reduce salary costs,Develop practical professional skills,D,Internships enhance academic and professional development.,psr
PSR_2021,l5-7,exam,Volunteers are motivated mainly by:,Guaranteed employment,Desire to serve society,Promotion prospects,Travel opportunities,B,Volunteerism is driven by passion to serve humanity.,psr
PSR_2021,l5-7,exam,Transfer to the Federal Service is limited up to grade level:,GL 17,GL 06,GL 03,GL 14,D,Transfer into Federal Service is limited to GL 07–14.,psr
PSR_2021,l5-7,exam,Secondment extensions must be approved by:,Appropriate committees and FCSC,Only the officer,Union leaders,Local supervisors,A,Extensions require committee and FCSC approval.,psr
PSR_2021,l5-7,exam,"During secondment, the officer retains entitlement to:",Automatic retirement,No evaluation,Reduced salary,Increment and promotion,D,Seconded officers retain increment and promotion rights.,psr
PSR_2021,l5-7,exam,Posting decisions must ensure fairness to avoid:,Administrative balance,Coercion or cronyism,Career growth,Skill development,B,Posting must not be used as coercion or cronyism.,psr
PSR_2021,l5-7,exam,An officer may request posting to spouse’s location provided:,Union approves,The spouse is a civil servant,There is an established post available,Travel is funded by government,C,Posting is allowed if a relevant established post exists.,psr
PSR_2021,l5-7,exam,Union executives are protected from posting until:,Expiration of their tenure,Promotion,One year of service,Annual leave,A,They cannot be posted until tenure expires.,psr
PSR_2021,l5-7,exam,Acting appointments are normally used to:,Test probationers,Avoid recruitment,Reward seniority,Fill temporarily vacant posts,D,They fill temporarily vacant duty posts.,psr
PSR_2021,l5-7,exam,Acting appointments must be published in the:,Internal memo only,Official Gazette,Local newspaper,Union bulletin,B,Approved acting appointments are gazetted.,psr
PSR_2021,l5-7,exam,Backdating of acting appointments cannot exceed:,Three months,One year,Two years,Six months,D,They cannot be backdated beyond six months.,psr
PSR_2021,l5-7,exam,An acting officer on casual leave is considered to:,Still hold acting duties,Automatically relinquish post,Be promoted,Be suspended,A,Casual leave does not end acting responsibilities.,psr
PSR_2021,l5-7,exam,Which document must accompany a transfer application forwarded to FCSC under Rule 020307?,Statement on performance/qualification and recommendation,Only a medical fitness report,A pension clearance certificate,Only a union endorsement letter,A,"Rule 020307 requires performance, qualification assessment, and recommendation to accompany the application.",psr
PSR_2021,l5-7,exam,"Under PSR contract processing, who is responsible for working out and approving the waiver for desired skills?",OHCSF,Office of the Auditor-General,National Pension Commission,Receiving MDAs union,A,Rule 020405(i) assigns OHCSF responsibility for waiver approval after MDA defense.,psr
PSR_2021,l5-7,exam,Which is a stated condition for offering contract appointment to Nigerians under Rule 020403(v)?,They are under 30 years,They must be on probation,They must be on GL 06,They are pensioners,D,Rule 020403(v)(a) permits contract appointment for pensioners (among other conditions).,psr
PSR_2021,l5-7,exam,Contract appointment selection must be fair/open/competitive and must not ____.,Be advertised,Involve OHCSF,Jeopardize career prospects of serving officers,Replace all serving officers,C,Rule 020405(iv) prevents jeopardizing serving officers career prospects.,psr
PSR_2021,l5-7,exam,"For non-Nigerian contract appointment, Government undertakes immigration responsibilities for ____.",Union registration,Working/residence permit,Pension enrolment,Promotion clearance,B,Rule 020405(v) covers working/residence permits.,psr
PSR_2021,l5-7,exam,A contract officer seeking re-engagement must notify through the Permanent Secretary/Head of Office not less than ____.,One month before contract ends,Six months after leave,Four months before leave is due,Two weeks before leave,C,Rule 020408 sets four months notice before leave is due.,psr
PSR_2021,l5-7,exam,Which outcome may be assumed if the contract officer gives no re-engagement notification?,Officer is transferred,Officer is promoted,Officer is automatically re-engaged,Officer does not desire re-engagement,D,Rule 020408 allows the assumption the officer does not desire re-engagement.,psr
PSR_2021,l5-7,exam,Secondment extensions beyond the first instance require approval by ____.,Only the receiving MDA,The union executives,Appropriate Committees and FCSC/Board,Only the releasing MDA,C,Rule 020503(f) requires committee and FCSC/Board approval.,psr
PSR_2021,l5-7,exam,"Under Rule 020504, where there is differential pay on secondment in public interest, the salary is paid by the ____.",Officer personally,Receiving MDA only in all cases,MDA with higher pay,Releasing MDA only in all cases,C,Rule 020504 assigns salary to the higher-paying MDA; allowances by receiving MDA.,psr
PSR_2021,l5-7,exam,Transfer to the Federal Service is limited to posts graded GL 07 to ____.,14,10,17,6,A,Rule 020503(c) limits transfer to GL 0714 or equivalent.,psr
PSR_2021,l5-7,exam,Which principle must underlie posting decisions according to Rule 020603?,Union preference,Fairness to all officers,Budget availability only,Seniority only,B,Rule 020603 emphasizes fairness to prevent coercion/punishment/cronyism.,psr
PSR_2021,l5-7,exam,Posting complaints must be submitted through appropriate channel within three working days ____.,the posting is released,before gazetting,after approval of relocation claims,of resumption at new station,A,Rule 020606 requires submission within three working days the posting is released.,psr
PSR_2021,l5-7,exam,Which statement is TRUE about posting pool officers under Rule 020602(iii)?,It is mandatory after every four years,It applies only to GL 06 and below,It is optional at officers request,It is only for union executives,A,Rule 020602(iii) makes pool postings mandatory after every four years.,psr
PSR_2021,l5-7,exam,Trade unions/staff associations must introduce tenure limit of ____ terms in their constitutions.,Three (3),Four (4),Two (2),One (1),C,Rule 020612 mandates two terms.,psr
PSR_2021,l5-7,exam,Duration for each union tenure shall not be more than ____ years.,Four (4),One (1),Two (2),Three (3),C,Rule 020612 caps each tenure at two years.,psr
PSR_2021,l5-7,exam,An acting appointment should not be made merely because substantive holder is absent on casual/sick leave; it is made only when ____.,Union requests it,Officer volunteers,It increases revenue,Necessary/desirable per FCSC/Board decision,D,Rule 020702 sets this limitation; FCSC/Board decides necessity.,psr
PSR_2021,l5-7,exam,Acting appointment recommendations must include a certificate that the acting officer will ____.,Work part-time only,Assume full duties/responsibilities,Remain in old duties,Decline relocation,B,Rule 020704(a) requires certification of full duty assumption.,psr
PSR_2021,l5-7,exam,Which form is used to notify FCSC when officers revert from acting appointment?,Form Gen. 15A,Form Gen. 60,General Form 66,FCSC Form 2,A,Rule 020707 specifies Form Gen. 15A.,psr
PSR_2021,l5-7,exam,"During acting appointment, casual/special leave in Nigeria does not count as relinquishing duties provided ____.",Leave exceeds one month,No replacement acting officer is needed,Officer resigns,Leave is outside Nigeria,B,Rule 020708(a) allows it if no replacement is necessary and leave is in Nigeria.,psr
PSR_2021,l5-7,exam,"Where the Head of a Department is unavailable for one month due to annual leave, the office is overseen by ____.",External consultant,Union executive,Newest officer,Most senior officer in the Department/Organization,D,Rule 020708(b) mandates the most senior officer to oversee.,psr
PSR_2021,l5-7,exam,Authority approving transfer between senior posts is:,Immediate supervisor,Finance department,Federal Civil Service Commission,Union executive,C,FCSC approves transfer between senior posts.,psr
PSR_2021,l5-7,exam,Transfer application must be forwarded through:,Permanent Secretary/Head of Office,Audit unit,Union office,Local HR clerk,A,Applications pass through the Permanent Secretary/Head of Office.,psr
PSR_2021,l5-7,exam,Contract appointments are primarily used to fill:,Union quotas,Temporary leave gaps,Routine vacancies,Specialized skill gaps,D,They address specialized skill shortages.,psr
PSR_2021,l5-7,exam,Contract appointment selection must be:,Merit-based and competitive,Internally informal,Union nominated,Based on seniority only,A,PSR requires fair competitive selection.,psr
PSR_2021,l5-7,exam,Interpretation of contract terms is referred to:,State government,Local HR office,Union council,OHCSF,D,OHCSF handles interpretation.,psr
PSR_2021,l5-7,exam,Contract officers must accept posting to:,Their home state,Urban centers only,Any part of the country,Only headquarters,C,They must accept nationwide posting.,psr
PSR_2021,l5-7,exam,Failure to notify re-engagement implies:,Promotion,Immediate termination,No desire for re-engagement,Automatic renewal,C,Silence implies no interest.,psr
PSR_2021,l5-7,exam,Consent for re-engagement must come from:,Receiving MDA,Finance ministry,Union leaders,OHCSF,D,OHCSF consent is required.,psr
PSR_2021,l5-7,exam,Internship programs aim to:,Replace permanent staff,Reduce salary costs,Develop practical skills,Test discipline,C,Internships develop professional skills.,psr
PSR_2021,l5-7,exam,Volunteerism is driven by:,Promotion prospects,Guaranteed employment,Travel benefits,Service to society,D,Volunteerism serves societal good.,psr
PSR_2021,l5-7,exam,Transfer to Federal Service is limited up to:,GL 03,GL 17,GL 14,GL 06,C,Transfer is limited to GL 07–14.,psr
PSR_2021,l5-7,exam,Secondment extensions require approval from:,Union executives,Only the officer,FCSC/appropriate committees,Receiving MDA alone,C,Extensions require formal approval.,psr
PSR_2021,l5-7,exam,Seconded officers retain entitlement to:,Reduced salary,No appraisal,Increment and promotion,Automatic retirement,C,They retain normal entitlements.,psr
PSR_2021,l5-7,exam,Posting fairness prevents:,Administrative rotation,Skill development,Performance review,Favoritism and coercion,D,Posting must avoid bias.,psr
